card_id,card_name,issuer,country,network,card_type,link,monthly_fee,annual_fee,welcome_bonus_summary,best_for,one_liner,eligibility_summary,purchase_rate,cash_advance_rate,minimum_credit_limit,supplementary_card_fee,supplementary_card_fee_detail,rewards_summary,redemption_summary
scotia_value_card_ca,Scotiabank Value Visa Card,Scotiabank,Canada,American Express,Credit Card,https://www.scotiabank.com/ca/en/personal/credit-cards/visa/value-card.html,,29,,"travel,scene_plus_rewards,travel_insurance,cashback,student,no_annual_fee,low_interest",Travel and lifestyle rewards card focused on Scene+ points.,,13.99%,13.99%,500,0,,,redeem your points Credit card fees at a glance Credit card interest rates Checking your credit score Security and fraud Credit Card FAQs Tools Tools Tools Credit card calculators and tools Credit card rewards calculator Find the right credit solution for you Compare American Express Credit Cards Interest savings calculator Investments Investments Popular investments Popular investments Popular investments Tax-Free Savings Accounts (TFSA) First Home Savings Account (FHSA) Registered Retirement Savings Plans (RRSP) Registered Education Savings Plans (RESP) Guaranteed Investment Certificates (GICs) Scotia Essentials Portfolios Mutual Funds Ways to invest Ways to invest Ways to invest Talk to a Scotia advisor Guided investing - Scotia Smart Investor Self-directed investing – Scotia iTRADE Wealth management Scotia Financial Planning Tools and resources Tools and resources Tools and resources Investment calculators and tools TFSA calculator Investing basics Investment account fees Pre-Authorized Contributions (PAC) Regulatory disclosures Loans & Lines of Credit Loans & Lines of Credit Loans Loans Loans Scotia Plan Loan Auto loans Grad auto loans StartRight auto finance program Marine & boat loans Recreational vehicle (RV) loan Lines of Credit Lines of Credit Lines of Credit ScotiaLine Personal Line of Credit ScotiaLine Personal Line of Credit (STEP) ScotiaLine Personal Line of Credit for students Scotia RSP catch-up line of credit Tools Tools Tools Auto loan payment calculator Personal loan calculator Borrowing Basics Borrowing Basics Borrowing Basics Building a good credit history The loan or lease decision Lower your overall cost of borrowing How to choose a vehicle Mortgages Mortgages Advice Advice Advice Connect with a home financing advisor Buying another property Existing homeowners Mortgage renewal Renovations Understanding mortgage prepayments and charges Conventional vs.
scotia_scene_student_card_ca,Scotiabank Scene+ Visa Card for Students,Scotiabank,Canada,American Express,Credit Card,https://www.scotiabank.com/ca/en/personal/credit-cards/visa/scene-student-card.html,,0,,"travel,scene_plus_rewards,dining,groceries,entertainment,travel_insurance,cashback,student,no_annual_fee,low_interest",Travel and lifestyle rewards card focused on Scene+ points.,,20.99%,22.99%,500,0,,"Earn 1 Scene+ point for every $1 you spend on eligible travel purchases | At Sobeys, Safeway, Foodland, participating IGA and Co-ops, and more","Apply Scene+ points to travel With Scene+, you have the flexibility to use your points on travel purchases, the way you want. To apply points to travel 6 : Use your Scotiabank Scene+ Visa Card to book your vacation with your favourite travel provider Wait for the purchase to be posted to your card Sign in to sceneplus.ca opens in a new tab and select Apply Points to Travel to redeem your points to cover the full or partial travel cost You can redeem points to cover your travel costs within 12 months from the date of your travel purchase Or, to book with Scene+ Travel, Powered by Expedia 5 : Sign into sceneplus."
scotia_student_value_card_ca,Scotiabank Value Visa Card,Scotiabank,Canada,American Express,Credit Card,https://www.scotiabank.com/ca/en/personal/credit-cards/visa/student-value-card.html,,29,,"travel,scene_plus_rewards,travel_insurance,cashback,student,no_annual_fee,low_interest",Travel and lifestyle rewards card focused on Scene+ points.,,13.99%,13.99%,500,0,,,redeem your points Credit card fees at a glance Credit card interest rates Checking your credit score Security and fraud Credit Card FAQs Tools Tools Tools Credit card calculators and tools Credit card rewards calculator Find the right credit solution for you Compare American Express Credit Cards Interest savings calculator Investments Investments Popular investments Popular investments Popular investments Tax-Free Savings Accounts (TFSA) First Home Savings Account (FHSA) Registered Retirement Savings Plans (RRSP) Registered Education Savings Plans (RESP) Guaranteed Investment Certificates (GICs) Scotia Essentials Portfolios Mutual Funds Ways to invest Ways to invest Ways to invest Talk to a Scotia advisor Guided investing - Scotia Smart Investor Self-directed investing – Scotia iTRADE Wealth management Scotia Financial Planning Tools and resources Tools and resources Tools and resources Investment calculators and tools TFSA calculator Investing basics Investment account fees Pre-Authorized Contributions (PAC) Regulatory disclosures Loans & Lines of Credit Loans & Lines of Credit Loans Loans Loans Scotia Plan Loan Auto loans Grad auto loans StartRight auto finance program Marine & boat loans Recreational vehicle (RV) loan Lines of Credit Lines of Credit Lines of Credit ScotiaLine Personal Line of Credit ScotiaLine Personal Line of Credit (STEP) ScotiaLine Personal Line of Credit for students Scotia RSP catch-up line of credit Tools Tools Tools Auto loan payment calculator Personal loan calculator Borrowing Basics Borrowing Basics Borrowing Basics Building a good credit history The loan or lease decision Lower your overall cost of borrowing How to choose a vehicle Mortgages Mortgages Advice Advice Advice Connect with a home financing advisor Buying another property Existing homeowners Mortgage renewal Renovations Understanding mortgage prepayments and charges Conventional vs.
scotia_student_momentum_cash_back_card_ca,Scotiabank Momentum Visa Card,Scotiabank,Canada,American Express,Credit Card,https://www.scotiabank.com/ca/en/personal/credit-cards/visa/student-momentum-cash-back-card.html,,49,,"travel,scene_plus_rewards,groceries,transit,travel_insurance,cashback,student,no_annual_fee",Travel and lifestyle rewards card focused on Scene+ points.,,20.99%,22.99%,500,15,,"On all other eligible purchases Browse the Scotia Momentum Visa Card (for students) cash back Terms and Conditions As long as you have over $25 in Cash Back, you can redeem it at any time through the Scotia mobile app or online banking | on all other eligible Purchases made with the Account that are not within the Accelerated Earn Rate categories | earn cash back when use your card for eligible recurring payments like subscriptions, insurance, and gym memberships to your card | earn Cash Back at the Regular Earn Rate on all eligible Purchases made on your Account until the annual spend limit resets",redeem your points Credit card fees at a glance Credit card interest rates Checking your credit score Security and fraud Credit Card FAQs Tools Tools Tools Credit card calculators and tools Credit card rewards calculator Find the right credit solution for you Compare American Express Credit Cards Interest savings calculator Investments Investments Popular investments Popular investments Popular investments Tax-Free Savings Accounts (TFSA) First Home Savings Account (FHSA) Registered Retirement Savings Plans (RRSP) Registered Education Savings Plans (RESP) Guaranteed Investment Certificates (GICs) Scotia Essentials Portfolios Mutual Funds Ways to invest Ways to invest Ways to invest Talk to a Scotia advisor Guided investing - Scotia Smart Investor Self-directed investing – Scotia iTRADE Wealth management Scotia Financial Planning Tools and resources Tools and resources Tools and resources Investment calculators and tools TFSA calculator Investing basics Investment account fees Pre-Authorized Contributions (PAC) Regulatory disclosures Loans & Lines of Credit Loans & Lines of Credit Loans Loans Loans Scotia Plan Loan Auto loans Grad auto loans StartRight auto finance program Marine & boat loans Recreational vehicle (RV) loan Lines of Credit Lines of Credit Lines of Credit ScotiaLine Personal Line of Credit ScotiaLine Personal Line of Credit (STEP) ScotiaLine Personal Line of Credit for students Scotia RSP catch-up line of credit Tools Tools Tools Auto loan payment calculator Personal loan calculator Borrowing Basics Borrowing Basics Borrowing Basics Building a good credit history The loan or lease decision Lower your overall cost of borrowing How to choose a vehicle Mortgages Mortgages Advice Advice Advice Connect with a home financing advisor Buying another property Existing homeowners Mortgage renewal Renovations Understanding mortgage prepayments and charges Conventional vs.
scotia_student_scotia_momentum_no_fee_visa_ca,Scotiabank Scotia Momentum No-Fee Visa Card for Students,Scotiabank,Canada,American Express,Credit Card,https://www.scotiabank.com/ca/en/personal/credit-cards/visa/student-scotia-momentum-no-fee-visa.html,,0,,"travel,scene_plus_rewards,groceries,transit,travel_insurance,cashback,student,no_annual_fee",Travel and lifestyle rewards card focused on Scene+ points.,,20.99%,22.99%,500,0,,"On all other eligible purchases Browse the Scotia Momentum No-Fee Visa Card (for students) cash back Terms and Conditions As long as you have over $25 in Cash Back, you can redeem it at any time through the Scotia mobile app or online banking | on all other eligible Purchases made with the Account that are not within the Accelerated Earn Rate categories | earn cash back when you charge eligible recurring payments like subscriptions, insurance, and gym memberships to your card | earn Cash Back at the Regular Earn Rate on all eligible Purchases made on your Account until the annual spend limit resets",redeem your points Credit card fees at a glance Credit card interest rates Checking your credit score Security and fraud Credit Card FAQs Tools Tools Tools Credit card calculators and tools Credit card rewards calculator Find the right credit solution for you Compare American Express Credit Cards Interest savings calculator Investments Investments Popular investments Popular investments Popular investments Tax-Free Savings Accounts (TFSA) First Home Savings Account (FHSA) Registered Retirement Savings Plans (RRSP) Registered Education Savings Plans (RESP) Guaranteed Investment Certificates (GICs) Scotia Essentials Portfolios Mutual Funds Ways to invest Ways to invest Ways to invest Talk to a Scotia advisor Guided investing - Scotia Smart Investor Self-directed investing – Scotia iTRADE Wealth management Scotia Financial Planning Tools and resources Tools and resources Tools and resources Investment calculators and tools TFSA calculator Investing basics Investment account fees Pre-Authorized Contributions (PAC) Regulatory disclosures Loans & Lines of Credit Loans & Lines of Credit Loans Loans Loans Scotia Plan Loan Auto loans Grad auto loans StartRight auto finance program Marine & boat loans Recreational vehicle (RV) loan Lines of Credit Lines of Credit Lines of Credit ScotiaLine Personal Line of Credit ScotiaLine Personal Line of Credit (STEP) ScotiaLine Personal Line of Credit for students Scotia RSP catch-up line of credit Tools Tools Tools Auto loan payment calculator Personal loan calculator Borrowing Basics Borrowing Basics Borrowing Basics Building a good credit history The loan or lease decision Lower your overall cost of borrowing How to choose a vehicle Mortgages Mortgages Advice Advice Advice Connect with a home financing advisor Buying another property Existing homeowners Mortgage renewal Renovations Understanding mortgage prepayments and charges Conventional vs.
